approved_at_utc,subreddit,selftext,author_fullname,saved,mod_reason_title,gilded,clicked,title,link_flair_richtext,subreddit_name_prefixed,hidden,pwls,link_flair_css_class,downs,top_awarded_type,hide_score,name,quarantine,link_flair_text_color,upvote_ratio,author_flair_background_color,subreddit_type,ups,total_awards_received,media_embed,author_flair_template_id,is_original_content,user_reports,secure_media,is_reddit_media_domain,is_meta,category,secure_media_embed,link_flair_text,can_mod_post,score,approved_by,author_premium,thumbnail,edited,author_flair_css_class,author_flair_richtext,gildings,content_categories,is_self,mod_note,created,link_flair_type,wls,removed_by_category,banned_by,author_flair_type,domain,allow_live_comments,selftext_html,likes,suggested_sort,banned_at_utc,view_count,archived,no_follow,is_crosspostable,pinned,over_18,all_awardings,awarders,media_only,can_gild,spoiler,locked,author_flair_text,treatment_tags,visited,removed_by,num_reports,distinguished,subreddit_id,mod_reason_by,removal_reason,link_flair_background_color,id,is_robot_indexable,report_reasons,author,discussion_type,num_comments,send_replies,whitelist_status,contest_mode,mod_reports,author_patreon_flair,author_flair_text_color,permalink,parent_whitelist_status,stickied,url,subreddit_subscribers,created_utc,num_crossposts,media,is_video
,investing,"Alright everyone, it looks like we had pretty broad support in [this thread](https://www.reddit.com/r/investing/comments/cuuo6j/yooo_get_in_here_peeps_state_of_the_subreddit/) when it comes to cracking down on the hyper partisanship that's been spilling out of the political subreddits to all corners of reddit.  In this thread I'm going to lay out some formal guidelines for comments on political topics.  Since this is so widespread I want to be clear here: this post is everyone's formal warning.  That means temporary or in some cases permanent bans are being handed out for people who violate said guidelines immediately.  This is really the only way to deal wit this issue.  I'm going to try to get automod to sticky applicable threads with this post as well.   

**First lets address politics**

I want to note something first: we are absolutely enforcing higher posting standards for political threads.  I think it's entirely uncontroversial to point out that calling Warren Buffett an asshole doesn't nearly stir up the anger that calling any given political figure an asshole will.  Comments like that being upvoted quickly derail threads and drive the discussion away from investing.  

**So here's the simple guideline which I'll expand on: you're free to express your opinion so long as it's tied to investing, you put effort in to it, and it's civil.**  We're not here to stop the free flow of discussion or ideas but we are here to keep discussion surrounding investing and civil.

**Tied to investing:** this should be pretty straightforward but I'm laying it out here anyway.  Investing encompasses markets, economic impacts, corporate profits, shifts in the yield curve, the federal reserve, taxes, potential government spending that may impact your portfolio.  

Investing does not encompass immigration, personal lives of politicians, social issues, climate change(unless specifically within the context of impact to energy or similar), how you feel about a particular news organization's potential biases, etc.  If it's not in the first list it's probably not investing related.  Making comments pertaining to non investment related politics only serves to drive the conversation off course and create a thread that is indistinguishable from one in a political subreddit.  Driving conversation off topic in high level comments by bringing up politics in unrelated threads also falls in this category.  

**Effort:** no shitposts.  If you're not conveying a thought or analysis of a particular subject then it's probably best to not post.  Furthermore top level comments like ""fuck my portfolio"" don't help keeping conversation on track.  Lastly and most importantly anything that falls in to the political meme universe isn't going to fly here.  That means if you're repeating something like TDS, MAGA, trade wars are good and easy to win, Pocahontas, orange man bad, any of the millions of nicknames for the president, very stable genius, any given childish spin on Democrat/republican(ex DemocRAT or Republitard), etc isn't tolerated.  These sorts of things only serve to agitate those on the opposite end of the political spectrum and create partisan arguments.

Your post should be something like ""I disagree/agree with Trump here because [policy] will do XYZ which is good/bad for ABC and blah blah blah blah"".  If you are unable to express an investment related position on a topic without insults and memes then you probably should just go to a political subreddit and comment there.

Special note here: conspiracy theories about politics and markets are not allowed.  If you are going to imply criminal market manipulation or insider trading proof in the form of reporting or other documentation is necessary.  This is not a place for baseless accusations derived from political leaning. 

**Civility:** so we already don't allow personal attacks here.  Generally speaking many people identify so closely with political parties and politicians that they react to political attacks the same way they will to personal attacks.  I get it, people get worked up over politics.  Translating that emotion to a post here only serves to have people with opposing views get similarly worked up.  This isn't an appropriate subreddit for that.  We're here to discuss investing.  So any comment that would violate our personal attacks rule if you made it towards another user is prohibited against political parties or figures.  /r/investing is not a platform for people to express their outrage towards politicians or political parties.  There are tons of subreddits for that sort of thing. 

So now that the guidelines are made clear, here's the consequences.  In our observation the vast majority of people engaging in political attacks and low effort posts are not regular contributors.  They tend to frequent political subreddits and engage in political attacks elsewhere.  So we're automatically handing out 30 day bans for violation of the above rules.  If you feel like your ban was in error or unfair you can appeal in modmail but we're not really inclined to reverse decisions if you aren't already a regular contributor.  For egregious offenses the ban may be 60 days or permanent.  For overt racism, death threats against any public figure, or similar there is an automatic permanent ban.   

**Now Corporate vs Investment News**

/u/crasymike did an awesome job laying out the general guidelines here: https://www.reddit.com/r/investing/comments/b3ss3q/topics_being_removed_corporate_news_vs_investor/

I'm going to just copy some of the hard guidelines here so they're in the same place but take a look at that thread to see a full explanation.

tl;dr Not all corporate news is investment news. If you post a topic the onus is on you to guide the discussion towards investing. If the moderators feel that a topic lacks relevance (which is more clearly defined below) then it might be removed. Off-topic top-level comments have similar standards applied to them.

This means that the onus is on you as the person posting the topic to guide the discussion. As moderators all we can do is remove offending comments, but we can't incite relevant discussion in every topic.

Tell us, why is this political news impactful? Seek out an article that discusses market impacts rather than a generic article. If you want to post corporate news then find an article that includes the impact on the investment. Copy that information into the body of your post. Include price history. Add other pertinent links or details for the corporate.

If you include no relevant investing information then don't be surprised if the topic is completely derailed from discussing investing. If you are posting a topic you need to invite people to talk about investing by using an article, or including information, that is pertinent to investors.

As moderators, we have a few policies that we use to guide ourselves. This is a broad rule that requires some interpretation, but here we go:

* If we can't figure out how your topic relates to investing, and the article doesn't include any (or extremely little) market news, and the body of your post doesn't link the topic to investing we will probably remove it as off-topic.

*  If your topic has an indirect relation to investing (such as being about a public company, or is major market shifting news) but you included no market information and the article(s) you linked have no investing information we may remove it if we feel that there is no clear reason to expect on-topic comments.

* If someone posts a top-level comment on a thread that completely derails away from investing we will probably remove it.

**If the policies above would result in the modteam seemingly needing to remove nearly every top level comment in a thread, and we felt like your thread is ""borderline"" not investing news, then we will take this as confirmation that the topic wasn't investing news.  If the entire conversation in a thread is already driven off topic by political attacks or off topic discussion we will lock and remove a thread no matter how topical it is.  Please do your part and downvote/report political attacks even if you agree with them.  This will prevent us from just nuking a thread**",t2_p8vmm,False,,1,False,Formal posting guidelines for political topics and what constitutes investment vs corporate news. **READ BEFORE COMMENTING IN THIS SUB PLEASE**,[],r/investing,False,6,,0,,False,t3_cyee69,False,dark,0.95,,public,270,2,{},,False,[],,False,False,,{},,False,270,,False,,1567518369.0,,[],{'gid_2': 1},,True,,1567395088.0,text,6,,,text,self.investing,True,"&lt;!-- SC_OFF --&gt;&lt;div class=""md""&gt;&lt;p&gt;Alright everyone, it looks like we had pretty broad support in &lt;a href=""https://www.reddit.com/r/investing/comments/cuuo6j/yooo_get_in_here_peeps_state_of_the_subreddit/""&gt;this thread&lt;/a&gt; when it comes to cracking down on the hyper partisanship that&amp;#39;s been spilling out of the political subreddits to all corners of reddit.  In this thread I&amp;#39;m going to lay out some formal guidelines for comments on political topics.  Since this is so widespread I want to be clear here: this post is everyone&amp;#39;s formal warning.  That means temporary or in some cases permanent bans are being handed out for people who violate said guidelines immediately.  This is really the only way to deal wit this issue.  I&amp;#39;m going to try to get automod to sticky applicable threads with this post as well.   &lt;/p&gt;

&lt;p&gt;&lt;strong&gt;First lets address politics&lt;/strong&gt;&lt;/p&gt;

&lt;p&gt;I want to note something first: we are absolutely enforcing higher posting standards for political threads.  I think it&amp;#39;s entirely uncontroversial to point out that calling Warren Buffett an asshole doesn&amp;#39;t nearly stir up the anger that calling any given political figure an asshole will.  Comments like that being upvoted quickly derail threads and drive the discussion away from investing.  &lt;/p&gt;

&lt;p&gt;&lt;strong&gt;So here&amp;#39;s the simple guideline which I&amp;#39;ll expand on: you&amp;#39;re free to express your opinion so long as it&amp;#39;s tied to investing, you put effort in to it, and it&amp;#39;s civil.&lt;/strong&gt;  We&amp;#39;re not here to stop the free flow of discussion or ideas but we are here to keep discussion surrounding investing and civil.&lt;/p&gt;

&lt;p&gt;&lt;strong&gt;Tied to investing:&lt;/strong&gt; this should be pretty straightforward but I&amp;#39;m laying it out here anyway.  Investing encompasses markets, economic impacts, corporate profits, shifts in the yield curve, the federal reserve, taxes, potential government spending that may impact your portfolio.  &lt;/p&gt;

&lt;p&gt;Investing does not encompass immigration, personal lives of politicians, social issues, climate change(unless specifically within the context of impact to energy or similar), how you feel about a particular news organization&amp;#39;s potential biases, etc.  If it&amp;#39;s not in the first list it&amp;#39;s probably not investing related.  Making comments pertaining to non investment related politics only serves to drive the conversation off course and create a thread that is indistinguishable from one in a political subreddit.  Driving conversation off topic in high level comments by bringing up politics in unrelated threads also falls in this category.  &lt;/p&gt;

&lt;p&gt;&lt;strong&gt;Effort:&lt;/strong&gt; no shitposts.  If you&amp;#39;re not conveying a thought or analysis of a particular subject then it&amp;#39;s probably best to not post.  Furthermore top level comments like &amp;quot;fuck my portfolio&amp;quot; don&amp;#39;t help keeping conversation on track.  Lastly and most importantly anything that falls in to the political meme universe isn&amp;#39;t going to fly here.  That means if you&amp;#39;re repeating something like TDS, MAGA, trade wars are good and easy to win, Pocahontas, orange man bad, any of the millions of nicknames for the president, very stable genius, any given childish spin on Democrat/republican(ex DemocRAT or Republitard), etc isn&amp;#39;t tolerated.  These sorts of things only serve to agitate those on the opposite end of the political spectrum and create partisan arguments.&lt;/p&gt;

&lt;p&gt;Your post should be something like &amp;quot;I disagree/agree with Trump here because [policy] will do XYZ which is good/bad for ABC and blah blah blah blah&amp;quot;.  If you are unable to express an investment related position on a topic without insults and memes then you probably should just go to a political subreddit and comment there.&lt;/p&gt;

&lt;p&gt;Special note here: conspiracy theories about politics and markets are not allowed.  If you are going to imply criminal market manipulation or insider trading proof in the form of reporting or other documentation is necessary.  This is not a place for baseless accusations derived from political leaning. &lt;/p&gt;

&lt;p&gt;&lt;strong&gt;Civility:&lt;/strong&gt; so we already don&amp;#39;t allow personal attacks here.  Generally speaking many people identify so closely with political parties and politicians that they react to political attacks the same way they will to personal attacks.  I get it, people get worked up over politics.  Translating that emotion to a post here only serves to have people with opposing views get similarly worked up.  This isn&amp;#39;t an appropriate subreddit for that.  We&amp;#39;re here to discuss investing.  So any comment that would violate our personal attacks rule if you made it towards another user is prohibited against political parties or figures.  &lt;a href=""/r/investing""&gt;/r/investing&lt;/a&gt; is not a platform for people to express their outrage towards politicians or political parties.  There are tons of subreddits for that sort of thing. &lt;/p&gt;

&lt;p&gt;So now that the guidelines are made clear, here&amp;#39;s the consequences.  In our observation the vast majority of people engaging in political attacks and low effort posts are not regular contributors.  They tend to frequent political subreddits and engage in political attacks elsewhere.  So we&amp;#39;re automatically handing out 30 day bans for violation of the above rules.  If you feel like your ban was in error or unfair you can appeal in modmail but we&amp;#39;re not really inclined to reverse decisions if you aren&amp;#39;t already a regular contributor.  For egregious offenses the ban may be 60 days or permanent.  For overt racism, death threats against any public figure, or similar there is an automatic permanent ban.   &lt;/p&gt;

&lt;p&gt;&lt;strong&gt;Now Corporate vs Investment News&lt;/strong&gt;&lt;/p&gt;

&lt;p&gt;&lt;a href=""/u/crasymike""&gt;/u/crasymike&lt;/a&gt; did an awesome job laying out the general guidelines here: &lt;a href=""https://www.reddit.com/r/investing/comments/b3ss3q/topics_being_removed_corporate_news_vs_investor/""&gt;https://www.reddit.com/r/investing/comments/b3ss3q/topics_being_removed_corporate_news_vs_investor/&lt;/a&gt;&lt;/p&gt;

&lt;p&gt;I&amp;#39;m going to just copy some of the hard guidelines here so they&amp;#39;re in the same place but take a look at that thread to see a full explanation.&lt;/p&gt;

&lt;p&gt;tl;dr Not all corporate news is investment news. If you post a topic the onus is on you to guide the discussion towards investing. If the moderators feel that a topic lacks relevance (which is more clearly defined below) then it might be removed. Off-topic top-level comments have similar standards applied to them.&lt;/p&gt;

&lt;p&gt;This means that the onus is on you as the person posting the topic to guide the discussion. As moderators all we can do is remove offending comments, but we can&amp;#39;t incite relevant discussion in every topic.&lt;/p&gt;

&lt;p&gt;Tell us, why is this political news impactful? Seek out an article that discusses market impacts rather than a generic article. If you want to post corporate news then find an article that includes the impact on the investment. Copy that information into the body of your post. Include price history. Add other pertinent links or details for the corporate.&lt;/p&gt;

&lt;p&gt;If you include no relevant investing information then don&amp;#39;t be surprised if the topic is completely derailed from discussing investing. If you are posting a topic you need to invite people to talk about investing by using an article, or including information, that is pertinent to investors.&lt;/p&gt;

&lt;p&gt;As moderators, we have a few policies that we use to guide ourselves. This is a broad rule that requires some interpretation, but here we go:&lt;/p&gt;

&lt;ul&gt;
&lt;li&gt;&lt;p&gt;If we can&amp;#39;t figure out how your topic relates to investing, and the article doesn&amp;#39;t include any (or extremely little) market news, and the body of your post doesn&amp;#39;t link the topic to investing we will probably remove it as off-topic.&lt;/p&gt;&lt;/li&gt;
&lt;li&gt;&lt;p&gt;If your topic has an indirect relation to investing (such as being about a public company, or is major market shifting news) but you included no market information and the article(s) you linked have no investing information we may remove it if we feel that there is no clear reason to expect on-topic comments.&lt;/p&gt;&lt;/li&gt;
&lt;li&gt;&lt;p&gt;If someone posts a top-level comment on a thread that completely derails away from investing we will probably remove it.&lt;/p&gt;&lt;/li&gt;
&lt;/ul&gt;

&lt;p&gt;&lt;strong&gt;If the policies above would result in the modteam seemingly needing to remove nearly every top level comment in a thread, and we felt like your thread is &amp;quot;borderline&amp;quot; not investing news, then we will take this as confirmation that the topic wasn&amp;#39;t investing news.  If the entire conversation in a thread is already driven off topic by political attacks or off topic discussion we will lock and remove a thread no matter how topical it is.  Please do your part and downvote/report political attacks even if you agree with them.  This will prevent us from just nuking a thread&lt;/strong&gt;&lt;/p&gt;
&lt;/div&gt;&lt;!-- SC_ON --&gt;",,,,,True,False,False,False,False,"[{'giver_coin_reward': None, 'subreddit_id': None, 'is_new': False, 'days_of_drip_extension': 0, 'coin_price': 500, 'id': 'gid_2', 'penny_donate': None, 'award_sub_type': 'GLOBAL', 'coin_reward': 100, 'icon_url': 'https://www.redditstatic.com/gold/awards/icon/gold_512.png', 'days_of_premium': 7, 'tiers_by_required_awardings': None, 'resized_icons': [{'url': 'https://www.redditstatic.com/gold/awards/icon/gold_16.png', 'width': 16, 'height': 16}, {'url': 'https://www.redditstatic.com/gold/awards/icon/gold_32.png', 'width': 32, 'height': 32}, {'url': 'https://www.redditstatic.com/gold/awards/icon/gold_48.png', 'width': 48, 'height': 48}, {'url': 'https://www.redditstatic.com/gold/awards/icon/gold_64.png', 'width': 64, 'height': 64}, {'url': 'https://www.redditstatic.com/gold/awards/icon/gold_128.png', 'width': 128, 'height': 128}], 'icon_width': 512, 'static_icon_width': 512, 'start_date': None, 'is_enabled': True, 'awardings_required_to_grant_benefits': None, 'description': 'Gives the author a week of Reddit Premium, %{coin_symbol}100 Coins to do with as they please, and shows a Gold Award.', 'end_date': None, 'subreddit_coin_reward': 0, 'count': 1, 'static_icon_height': 512, 'name': 'Gold', 'resized_static_icons': [{'url': 'https://www.redditstatic.com/gold/awards/icon/gold_16.png', 'width': 16, 'height': 16}, {'url': 'https://www.redditstatic.com/gold/awards/icon/gold_32.png', 'width': 32, 'height': 32}, {'url': 'https://www.redditstatic.com/gold/awards/icon/gold_48.png', 'width': 48, 'height': 48}, {'url': 'https://www.redditstatic.com/gold/awards/icon/gold_64.png', 'width': 64, 'height': 64}, {'url': 'https://www.redditstatic.com/gold/awards/icon/gold_128.png', 'width': 128, 'height': 128}], 'icon_format': None, 'icon_height': 512, 'penny_price': None, 'award_type': 'global', 'static_icon_url': 'https://www.redditstatic.com/gold/awards/icon/gold_512.png'}, {'giver_coin_reward': 0, 'subreddit_id': None, 'is_new': False, 'days_of_drip_extension': 0, 'coin_price': 100, 'id': 'award_74fe5152-7906-4991-9016-bc2d8e261200', 'penny_donate': 0, 'award_sub_type': 'GLOBAL', 'coin_reward': 0, 'icon_url': 'https://i.redd.it/award_images/t5_22cerq/x069ow7ewnf51_Excited.png', 'days_of_premium': 0, 'tiers_by_required_awardings': None, 'resized_icons': [{'url': 'https://preview.redd.it/award_images/t5_22cerq/x069ow7ewnf51_Excited.png?width=16&amp;height=16&amp;auto=webp&amp;s=094da86916604f4fc9f7f63c827e31c976f00928', 'width': 16, 'height': 16}, {'url': 'https://preview.redd.it/award_images/t5_22cerq/x069ow7ewnf51_Excited.png?width=32&amp;height=32&amp;auto=webp&amp;s=52886a42b9871ec69a4465609472a864dbab27b1', 'width': 32, 'height': 32}, {'url': 'https://preview.redd.it/award_images/t5_22cerq/x069ow7ewnf51_Excited.png?width=48&amp;height=48&amp;auto=webp&amp;s=63a8f5eff627778a221c58daffbfbbb87b7fe350', 'width': 48, 'height': 48}, {'url': 'https://preview.redd.it/award_images/t5_22cerq/x069ow7ewnf51_Excited.png?width=64&amp;height=64&amp;auto=webp&amp;s=da0d9de08517646db45b766dbb0e7b94d2e97312', 'width': 64, 'height': 64}, {'url': 'https://preview.redd.it/award_images/t5_22cerq/x069ow7ewnf51_Excited.png?width=128&amp;height=128&amp;auto=webp&amp;s=58d3501a4314be9d47349a1f7925e18f30a832e5', 'width': 128, 'height': 128}], 'icon_width': 2048, 'static_icon_width': 2048, 'start_date': None, 'is_enabled': False, 'awardings_required_to_grant_benefits': None, 'description': ""I don't know what to do with my hands!"", 'end_date': None, 'subreddit_coin_reward': 0, 'count': 1, 'static_icon_height': 2048, 'name': 'Excited', 'resized_static_icons': [{'url': 'https://preview.redd.it/award_images/t5_22cerq/x069ow7ewnf51_Excited.png?width=16&amp;height=16&amp;auto=webp&amp;s=094da86916604f4fc9f7f63c827e31c976f00928', 'width': 16, 'height': 16}, {'url': 'https://preview.redd.it/award_images/t5_22cerq/x069ow7ewnf51_Excited.png?width=32&amp;height=32&amp;auto=webp&amp;s=52886a42b9871ec69a4465609472a864dbab27b1', 'width': 32, 'height': 32}, {'url': 'https://preview.redd.it/award_images/t5_22cerq/x069ow7ewnf51_Excited.png?width=48&amp;height=48&amp;auto=webp&amp;s=63a8f5eff627778a221c58daffbfbbb87b7fe350', 'width': 48, 'height': 48}, {'url': 'https://preview.redd.it/award_images/t5_22cerq/x069ow7ewnf51_Excited.png?width=64&amp;height=64&amp;auto=webp&amp;s=da0d9de08517646db45b766dbb0e7b94d2e97312', 'width': 64, 'height': 64}, {'url': 'https://preview.redd.it/award_images/t5_22cerq/x069ow7ewnf51_Excited.png?width=128&amp;height=128&amp;auto=webp&amp;s=58d3501a4314be9d47349a1f7925e18f30a832e5', 'width': 128, 'height': 128}], 'icon_format': 'PNG', 'icon_height': 2048, 'penny_price': 0, 'award_type': 'global', 'static_icon_url': 'https://i.redd.it/award_images/t5_22cerq/x069ow7ewnf51_Excited.png'}]",[],False,False,False,True,,[],False,,,,t5_2qhhq,,,,cyee69,True,,MasterCookSwag,,0,True,all_ads,False,[],False,,/r/investing/comments/cyee69/formal_posting_guidelines_for_political_topics/,all_ads,True,https://www.reddit.com/r/investing/comments/cyee69/formal_posting_guidelines_for_political_topics/,1209704,1567366288.0,2,,False
