,investing,"Hi everyone! I just started trying to invest, found a stock LTRPA that owns 23% of TRIP, which implies a market cap of $800m based on TRIP's $3.7bn market cap, but the market cap is $300m. What am I missing here???? Shouldn't LTRPA at least double?? Sorry for the naive question! Also, Tripadvisor's earnings are almost back to prepandemic levels due to cost cutting and new initiatives in markets like Dubai, so it should be way more leveraged to a reopen",t2_91qwg9bj,False,,0,False,Liberty Tripadvisor Stock,[],r/investing,False,6,,0,,True,t3_k1d8eh,False,dark,1.0,,public,1,0,{},,False,[],,False,False,,{},,False,1,,False,,False,,[],{},,True,,1606416809.0,text,6,,,text,self.investing,False,"&lt;!-- SC_OFF --&gt;&lt;div class=""md""&gt;&lt;p&gt;Hi everyone! I just started trying to invest, found a stock LTRPA that owns 23% of TRIP, which implies a market cap of $800m based on TRIP&amp;#39;s $3.7bn market cap, but the market cap is $300m. What am I missing here???? Shouldn&amp;#39;t LTRPA at least double?? Sorry for the naive question! Also, Tripadvisor&amp;#39;s earnings are almost back to prepandemic levels due to cost cutting and new initiatives in markets like Dubai, so it should be way more leveraged to a reopen&lt;/p&gt;
&lt;/div&gt;&lt;!-- SC_ON --&gt;",,,,,False,False,False,False,False,[],[],False,False,False,False,,[],False,,,,t5_2qhhq,,,,k1d8eh,True,,Rare_Trainer,,4,True,all_ads,False,[],False,,/r/investing/comments/k1d8eh/liberty_tripadvisor_stock/,all_ads,False,https://www.reddit.com/r/investing/comments/k1d8eh/liberty_tripadvisor_stock/,1209704,1606388009.0,0,,False
,investing,"Hi all, I was wondering if I should buy the UK equivalent of the ETF? This is because I use Trading212 and they don't allow the purchase of the US etfs. I did a bit of research and found the return on the UK etfs are slightly lower because of the exchange rate. If I am planning on holding it for long term, how much will the exchange rate affect me and is it better to hold my etfs in GBP or USD?",t2_3qvqovnp,False,,0,False,"UK equivalent ETFS of the US (EQQQ vs QQQ, VUSA vs VOO etc.)",[],r/investing,False,6,,0,,False,t3_k1cucs,False,dark,1.0,,public,1,0,{},,False,[],,False,False,,{},,False,1,,False,,False,,[],{},,True,,1606414816.0,text,6,,,text,self.investing,False,"&lt;!-- SC_OFF --&gt;&lt;div class=""md""&gt;&lt;p&gt;Hi all, I was wondering if I should buy the UK equivalent of the ETF? This is because I use Trading212 and they don&amp;#39;t allow the purchase of the US etfs. I did a bit of research and found the return on the UK etfs are slightly lower because of the exchange rate. If I am planning on holding it for long term, how much will the exchange rate affect me and is it better to hold my etfs in GBP or USD?&lt;/p&gt;
&lt;/div&gt;&lt;!-- SC_ON --&gt;",,,,,False,False,False,False,False,[],[],False,False,False,False,,[],False,,,,t5_2qhhq,,,,k1cucs,True,,MarsupialAdept,,1,True,all_ads,False,[],False,,/r/investing/comments/k1cucs/uk_equivalent_etfs_of_the_us_eqqq_vs_qqq_vusa_vs/,all_ads,False,https://www.reddit.com/r/investing/comments/k1cucs/uk_equivalent_etfs_of_the_us_eqqq_vs_qqq_vusa_vs/,1209705,1606386016.0,0,,False
,investing,"For those of you looking at UK markets - I think good long term growth potential when Brexit teething problems and worst of covid out the way - what do you think of Tesco? 

Obviously fared well during the pandemic like the rest of the sector, but still below pre-covid prices and, with turnaround complete, could really push on in the New Year.

Relatively new to taking control of my own finances but seems to be decent value there in the long term.",t2_4q700dr9,False,,0,False,Value in Tesco?,[],r/investing,False,6,,0,,False,t3_k1ctik,False,dark,0.6,,public,1,0,{},,False,[],,False,False,,{},,False,1,,False,,False,,[],{},,True,,1606414691.0,text,6,,,text,self.investing,False,"&lt;!-- SC_OFF --&gt;&lt;div class=""md""&gt;&lt;p&gt;For those of you looking at UK markets - I think good long term growth potential when Brexit teething problems and worst of covid out the way - what do you think of Tesco? &lt;/p&gt;

&lt;p&gt;Obviously fared well during the pandemic like the rest of the sector, but still below pre-covid prices and, with turnaround complete, could really push on in the New Year.&lt;/p&gt;

&lt;p&gt;Relatively new to taking control of my own finances but seems to be decent value there in the long term.&lt;/p&gt;
&lt;/div&gt;&lt;!-- SC_ON --&gt;",,,,,False,False,False,False,False,[],[],False,False,False,False,,[],False,,,,t5_2qhhq,,,,k1ctik,True,,HugoDoss,,2,True,all_ads,False,[],False,,/r/investing/comments/k1ctik/value_in_tesco/,all_ads,False,https://www.reddit.com/r/investing/comments/k1ctik/value_in_tesco/,1209705,1606385891.0,0,,False
,investing," I'm currently unemployed due to a covid layoff and have decided to sell my shares of UPS stock. The problem is I do not know much about stocks and only accumulated this through work.

What would you recommend for the highest payout? A former co-worker recommends to hold off until 2021. I do not want to get too greedy either because the money would help so may just do it now.",t2_2hphqukf,False,,0,False,When to sell UPS Stock? Now or Jan 2021?,[],r/investing,False,6,,0,,False,t3_k12tfi,False,dark,0.72,,public,9,0,{},,False,[],,False,False,,{},,False,9,,False,,False,,[],{},,True,,1606373056.0,text,6,,,text,self.investing,False,"&lt;!-- SC_OFF --&gt;&lt;div class=""md""&gt;&lt;p&gt;I&amp;#39;m currently unemployed due to a covid layoff and have decided to sell my shares of UPS stock. The problem is I do not know much about stocks and only accumulated this through work.&lt;/p&gt;

&lt;p&gt;What would you recommend for the highest payout? A former co-worker recommends to hold off until 2021. I do not want to get too greedy either because the money would help so may just do it now.&lt;/p&gt;
&lt;/div&gt;&lt;!-- SC_ON --&gt;",,,,,False,False,False,False,False,[],[],False,False,False,False,,[],False,,,,t5_2qhhq,,,,k12tfi,True,,JustStatingFacts101,,18,True,all_ads,False,[],False,,/r/investing/comments/k12tfi/when_to_sell_ups_stock_now_or_jan_2021/,all_ads,False,https://www.reddit.com/r/investing/comments/k12tfi/when_to_sell_ups_stock_now_or_jan_2021/,1209705,1606344256.0,0,,False
,investing,"I have around 7k USD in Tesla right now, which is basically all my savings, and as you all know it's been going up a lot since the announcement that they would be added to the S&amp;P list.

Yesterday I figured that this growth would probably continue for the rest of December, since they still need to actually be added to the list. So I thought it would be a good idea to open up a loan with my bank for about 3k and invest it into Tesla. Because you know, leverage!

I believed this could play out in 2 ways.

1. Either Tesla goes up a bunch in the next month and I can pay back my loan with basically 0% interest and let the rest of my profit sit in Tesla.
2. Tesla doesn't go up immediately, or maybe even dip down a bit, and I just let my loan sit there. I have 18 months to pay it back and if I do that then it'll cost me 200 USD interest. But I feel relatively confident that in those 18 months I'll have made more than 200 USD from rising Tesla stock.

But this morning when I woke up I thought, hmmm, what if the stock actually plummets when they get added to the S&amp;P list, because maybe that's the exact moment that a lot of people will think it's the best time to sell their Tesla stock to make some money. I'm a bit scared of that scenario. Even though maybe I have nothing to be afraid of if I just let my money sit there for the full 18 months.

I wonder what the experienced investors in this subreddit find the most likely scenario. Do you think it will keep going up when Tesla actually gets added to the S&amp;P list? Or do you think it might plummet? Or just stay relatively stable?",t2_4rqo9,False,,0,False,"Question from a rookie, what do you guys think will happen to Tesla next month?",[],r/investing,False,6,,0,,False,t3_k1chqh,False,dark,0.5,,public,0,0,{},,False,[],,False,False,,{},,False,0,,False,,False,,[],{},,True,,1606413013.0,text,6,,,text,self.investing,False,"&lt;!-- SC_OFF --&gt;&lt;div class=""md""&gt;&lt;p&gt;I have around 7k USD in Tesla right now, which is basically all my savings, and as you all know it&amp;#39;s been going up a lot since the announcement that they would be added to the S&amp;amp;P list.&lt;/p&gt;

&lt;p&gt;Yesterday I figured that this growth would probably continue for the rest of December, since they still need to actually be added to the list. So I thought it would be a good idea to open up a loan with my bank for about 3k and invest it into Tesla. Because you know, leverage!&lt;/p&gt;

&lt;p&gt;I believed this could play out in 2 ways.&lt;/p&gt;

&lt;ol&gt;
&lt;li&gt;Either Tesla goes up a bunch in the next month and I can pay back my loan with basically 0% interest and let the rest of my profit sit in Tesla.&lt;/li&gt;
&lt;li&gt;Tesla doesn&amp;#39;t go up immediately, or maybe even dip down a bit, and I just let my loan sit there. I have 18 months to pay it back and if I do that then it&amp;#39;ll cost me 200 USD interest. But I feel relatively confident that in those 18 months I&amp;#39;ll have made more than 200 USD from rising Tesla stock.&lt;/li&gt;
&lt;/ol&gt;

&lt;p&gt;But this morning when I woke up I thought, hmmm, what if the stock actually plummets when they get added to the S&amp;amp;P list, because maybe that&amp;#39;s the exact moment that a lot of people will think it&amp;#39;s the best time to sell their Tesla stock to make some money. I&amp;#39;m a bit scared of that scenario. Even though maybe I have nothing to be afraid of if I just let my money sit there for the full 18 months.&lt;/p&gt;

&lt;p&gt;I wonder what the experienced investors in this subreddit find the most likely scenario. Do you think it will keep going up when Tesla actually gets added to the S&amp;amp;P list? Or do you think it might plummet? Or just stay relatively stable?&lt;/p&gt;
&lt;/div&gt;&lt;!-- SC_ON --&gt;",,,,,False,False,False,False,False,[],[],False,False,False,False,,[],False,,,,t5_2qhhq,,,,k1chqh,True,,live_love_laugh,,16,True,all_ads,False,[],False,,/r/investing/comments/k1chqh/question_from_a_rookie_what_do_you_guys_think/,all_ads,False,https://www.reddit.com/r/investing/comments/k1chqh/question_from_a_rookie_what_do_you_guys_think/,1209705,1606384213.0,0,,False
,investing,"Good morning from Spain. I recently got into investing small amounts of money 400-600€. I was using the trading platform trading212 but after a time, I feel like the platform has too many basic problems, loss of connection, bad page design etc.

Which platform do you guys recommend?

I’m not a total beginner the way, so please all advice you can offer is welcome. 

Thank you all.",t2_11um7e,False,,0,False,Which app do you guys recommend to people new to investing?,[],r/investing,False,6,,0,,False,t3_k1cfdr,False,dark,0.67,,public,1,0,{},,False,[],,False,False,,{},,False,1,,False,,False,,[],{},,True,,1606412653.0,text,6,,,text,self.investing,False,"&lt;!-- SC_OFF --&gt;&lt;div class=""md""&gt;&lt;p&gt;Good morning from Spain. I recently got into investing small amounts of money 400-600€. I was using the trading platform trading212 but after a time, I feel like the platform has too many basic problems, loss of connection, bad page design etc.&lt;/p&gt;

&lt;p&gt;Which platform do you guys recommend?&lt;/p&gt;

&lt;p&gt;I’m not a total beginner the way, so please all advice you can offer is welcome. &lt;/p&gt;

&lt;p&gt;Thank you all.&lt;/p&gt;
&lt;/div&gt;&lt;!-- SC_ON --&gt;",,,,,False,False,False,False,False,[],[],False,False,False,False,,[],False,,,,t5_2qhhq,,,,k1cfdr,True,,Ar3tri304,,2,True,all_ads,False,[],False,,/r/investing/comments/k1cfdr/which_app_do_you_guys_recommend_to_people_new_to/,all_ads,False,https://www.reddit.com/r/investing/comments/k1cfdr/which_app_do_you_guys_recommend_to_people_new_to/,1209705,1606383853.0,0,,False
,investing,"https://www.marketwatch.com/articles/dow-crosses-30000-as-stocks-stage-a-v-shaped-rebound-51605548142?mod=mw_latestnews

I didn't think we'd be here so fast after March. Which was the only time id ever really had any of my risk tolerance tested (my delta stock :s ).

can't believe it hit here before the end of 2020

edit at 4:01PM EST: Dow finishes above 30,000 mark too at market close.",t2_58yrh,False,,0,False,"Dow Crosses 30,000 mark-first time ever",[],r/investing,False,6,,0,,False,t3_k08gnz,False,dark,0.97,,public,1926,4,{},,False,[],,False,False,,{},,False,1926,,False,,1606251689.0,,[],{},,True,,1606264854.0,text,6,,,text,self.investing,True,"&lt;!-- SC_OFF --&gt;&lt;div class=""md""&gt;&lt;p&gt;&lt;a href=""https://www.marketwatch.com/articles/dow-crosses-30000-as-stocks-stage-a-v-shaped-rebound-51605548142?mod=mw_latestnews""&gt;https://www.marketwatch.com/articles/dow-crosses-30000-as-stocks-stage-a-v-shaped-rebound-51605548142?mod=mw_latestnews&lt;/a&gt;&lt;/p&gt;

&lt;p&gt;I didn&amp;#39;t think we&amp;#39;d be here so fast after March. Which was the only time id ever really had any of my risk tolerance tested (my delta stock :s ).&lt;/p&gt;

&lt;p&gt;can&amp;#39;t believe it hit here before the end of 2020&lt;/p&gt;

&lt;p&gt;edit at 4:01PM EST: Dow finishes above 30,000 mark too at market close.&lt;/p&gt;
&lt;/div&gt;&lt;!-- SC_ON --&gt;",,,,,False,False,False,False,False,"[{'giver_coin_reward': None, 'subreddit_id': None, 'is_new': False, 'days_of_drip_extension': 0, 'coin_price': 150, 'id': 'award_f44611f1-b89e-46dc-97fe-892280b13b82', 'penny_donate': None, 'award_sub_type': 'GLOBAL', 'coin_reward': 0, 'icon_url': 'https://i.redd.it/award_images/t5_22cerq/klvxk1wggfd41_Helpful.png', 'days_of_premium': 0, 'tiers_by_required_awardings': None, 'resized_icons': [{'url': 'https://preview.redd.it/award_images/t5_22cerq/klvxk1wggfd41_Helpful.png?width=16&amp;height=16&amp;auto=webp&amp;s=a5662dfbdb402bf67866c050aa76c31c147c2f45', 'width': 16, 'height': 16}, {'url': 'https://preview.redd.it/award_images/t5_22cerq/klvxk1wggfd41_Helpful.png?width=32&amp;height=32&amp;auto=webp&amp;s=a6882eb3f380e8e88009789f4d0072e17b8c59f1', 'width': 32, 'height': 32}, {'url': 'https://preview.redd.it/award_images/t5_22cerq/klvxk1wggfd41_Helpful.png?width=48&amp;height=48&amp;auto=webp&amp;s=e50064b090879e8a0b55e433f6ee61d5cb5fbe1d', 'width': 48, 'height': 48}, {'url': 'https://preview.redd.it/award_images/t5_22cerq/klvxk1wggfd41_Helpful.png?width=64&amp;height=64&amp;auto=webp&amp;s=8e5bb2e76683cb6b161830bcdd9642049d6adc11', 'width': 64, 'height': 64}, {'url': 'https://preview.redd.it/award_images/t5_22cerq/klvxk1wggfd41_Helpful.png?width=128&amp;height=128&amp;auto=webp&amp;s=eda4a9246f95f42ee6940cc0ec65306fd20de878', 'width': 128, 'height': 128}], 'icon_width': 2048, 'static_icon_width': 2048, 'start_date': None, 'is_enabled': True, 'awardings_required_to_grant_benefits': None, 'description': 'Thank you stranger. Shows the award.', 'end_date': None, 'subreddit_coin_reward': 0, 'count': 1, 'static_icon_height': 2048, 'name': 'Helpful', 'resized_static_icons': [{'url': 'https://preview.redd.it/award_images/t5_22cerq/klvxk1wggfd41_Helpful.png?width=16&amp;height=16&amp;auto=webp&amp;s=a5662dfbdb402bf67866c050aa76c31c147c2f45', 'width': 16, 'height': 16}, {'url': 'https://preview.redd.it/award_images/t5_22cerq/klvxk1wggfd41_Helpful.png?width=32&amp;height=32&amp;auto=webp&amp;s=a6882eb3f380e8e88009789f4d0072e17b8c59f1', 'width': 32, 'height': 32}, {'url': 'https://preview.redd.it/award_images/t5_22cerq/klvxk1wggfd41_Helpful.png?width=48&amp;height=48&amp;auto=webp&amp;s=e50064b090879e8a0b55e433f6ee61d5cb5fbe1d', 'width': 48, 'height': 48}, {'url': 'https://preview.redd.it/award_images/t5_22cerq/klvxk1wggfd41_Helpful.png?width=64&amp;height=64&amp;auto=webp&amp;s=8e5bb2e76683cb6b161830bcdd9642049d6adc11', 'width': 64, 'height': 64}, {'url': 'https://preview.redd.it/award_images/t5_22cerq/klvxk1wggfd41_Helpful.png?width=128&amp;height=128&amp;auto=webp&amp;s=eda4a9246f95f42ee6940cc0ec65306fd20de878', 'width': 128, 'height': 128}], 'icon_format': None, 'icon_height': 2048, 'penny_price': None, 'award_type': 'global', 'static_icon_url': 'https://i.redd.it/award_images/t5_22cerq/klvxk1wggfd41_Helpful.png'}, {'giver_coin_reward': None, 'subreddit_id': None, 'is_new': False, 'days_of_drip_extension': 0, 'coin_price': 125, 'id': 'award_5f123e3d-4f48-42f4-9c11-e98b566d5897', 'penny_donate': None, 'award_sub_type': 'GLOBAL', 'coin_reward': 0, 'icon_url': 'https://i.redd.it/award_images/t5_22cerq/5izbv4fn0md41_Wholesome.png', 'days_of_premium': 0, 'tiers_by_required_awardings': None, 'resized_icons': [{'url': 'https://preview.redd.it/award_images/t5_22cerq/5izbv4fn0md41_Wholesome.png?width=16&amp;height=16&amp;auto=webp&amp;s=92932f465d58e4c16b12b6eac4ca07d27e3d11c0', 'width': 16, 'height': 16}, {'url': 'https://preview.redd.it/award_images/t5_22cerq/5izbv4fn0md41_Wholesome.png?width=32&amp;height=32&amp;auto=webp&amp;s=d11484a208d68a318bf9d4fcf371171a1cb6a7ef', 'width': 32, 'height': 32}, {'url': 'https://preview.redd.it/award_images/t5_22cerq/5izbv4fn0md41_Wholesome.png?width=48&amp;height=48&amp;auto=webp&amp;s=febdf28b6f39f7da7eb1365325b85e0bb49a9f63', 'width': 48, 'height': 48}, {'url': 'https://preview.redd.it/award_images/t5_22cerq/5izbv4fn0md41_Wholesome.png?width=64&amp;height=64&amp;auto=webp&amp;s=b4406a2d88bf86fa3dc8a45aacf7e0c7bdccc4fb', 'width': 64, 'height': 64}, {'url': 'https://preview.redd.it/award_images/t5_22cerq/5izbv4fn0md41_Wholesome.png?width=128&amp;height=128&amp;auto=webp&amp;s=19555b13e3e196b62eeb9160d1ac1d1b372dcb0b', 'width': 128, 'height': 128}], 'icon_width': 2048, 'static_icon_width': 2048, 'start_date': None, 'is_enabled': True, 'awardings_required_to_grant_benefits': None, 'description': 'When you come across a feel-good thing.', 'end_date': None, 'subreddit_coin_reward': 0, 'count': 2, 'static_icon_height': 2048, 'name': 'Wholesome', 'resized_static_icons': [{'url': 'https://preview.redd.it/award_images/t5_22cerq/5izbv4fn0md41_Wholesome.png?width=16&amp;height=16&amp;auto=webp&amp;s=92932f465d58e4c16b12b6eac4ca07d27e3d11c0', 'width': 16, 'height': 16}, {'url': 'https://preview.redd.it/award_images/t5_22cerq/5izbv4fn0md41_Wholesome.png?width=32&amp;height=32&amp;auto=webp&amp;s=d11484a208d68a318bf9d4fcf371171a1cb6a7ef', 'width': 32, 'height': 32}, {'url': 'https://preview.redd.it/award_images/t5_22cerq/5izbv4fn0md41_Wholesome.png?width=48&amp;height=48&amp;auto=webp&amp;s=febdf28b6f39f7da7eb1365325b85e0bb49a9f63', 'width': 48, 'height': 48}, {'url': 'https://preview.redd.it/award_images/t5_22cerq/5izbv4fn0md41_Wholesome.png?width=64&amp;height=64&amp;auto=webp&amp;s=b4406a2d88bf86fa3dc8a45aacf7e0c7bdccc4fb', 'width': 64, 'height': 64}, {'url': 'https://preview.redd.it/award_images/t5_22cerq/5izbv4fn0md41_Wholesome.png?width=128&amp;height=128&amp;auto=webp&amp;s=19555b13e3e196b62eeb9160d1ac1d1b372dcb0b', 'width': 128, 'height': 128}], 'icon_format': None, 'icon_height': 2048, 'penny_price': None, 'award_type': 'global', 'static_icon_url': 'https://i.redd.it/award_images/t5_22cerq/5izbv4fn0md41_Wholesome.png'}, {'giver_coin_reward': 0, 'subreddit_id': None, 'is_new': False, 'days_of_drip_extension': 0, 'coin_price': 80, 'id': 'award_8352bdff-3e03-4189-8a08-82501dd8f835', 'penny_donate': 0, 'award_sub_type': 'GLOBAL', 'coin_reward': 0, 'icon_url': 'https://i.redd.it/award_images/t5_22cerq/niiatoknifn51_Hugz.png', 'days_of_premium': 0, 'tiers_by_required_awardings': None, 'resized_icons': [{'url': 'https://preview.redd.it/award_images/t5_22cerq/niiatoknifn51_Hugz.png?width=16&amp;height=16&amp;auto=webp&amp;s=85b1aa61933f163dd2b77b1e78f4d82d9c947ec1', 'width': 16, 'height': 16}, {'url': 'https://preview.redd.it/award_images/t5_22cerq/niiatoknifn51_Hugz.png?width=32&amp;height=32&amp;auto=webp&amp;s=67935636337b07ca5b98d945f4bcdae26e5f567e', 'width': 32, 'height': 32}, {'url': 'https://preview.redd.it/award_images/t5_22cerq/niiatoknifn51_Hugz.png?width=48&amp;height=48&amp;auto=webp&amp;s=547d5fb33f5a4a5d6fc154cbd658638cc2b1c3a0', 'width': 48, 'height': 48}, {'url': 'https://preview.redd.it/award_images/t5_22cerq/niiatoknifn51_Hugz.png?width=64&amp;height=64&amp;auto=webp&amp;s=e17bc331183e7ba194314a34e43b35460a835fff', 'width': 64, 'height': 64}, {'url': 'https://preview.redd.it/award_images/t5_22cerq/niiatoknifn51_Hugz.png?width=128&amp;height=128&amp;auto=webp&amp;s=1b4e617f18af8d4e2c47c2f154d4422be43c809f', 'width': 128, 'height': 128}], 'icon_width': 2048, 'static_icon_width': 2048, 'start_date': None, 'is_enabled': True, 'awardings_required_to_grant_benefits': None, 'description': 'Everything is better with a good hug', 'end_date': None, 'subreddit_coin_reward': 0, 'count': 1, 'static_icon_height': 2048, 'name': 'Hugz', 'resized_static_icons': [{'url': 'https://preview.redd.it/award_images/t5_22cerq/niiatoknifn51_Hugz.png?width=16&amp;height=16&amp;auto=webp&amp;s=85b1aa61933f163dd2b77b1e78f4d82d9c947ec1', 'width': 16, 'height': 16}, {'url': 'https://preview.redd.it/award_images/t5_22cerq/niiatoknifn51_Hugz.png?width=32&amp;height=32&amp;auto=webp&amp;s=67935636337b07ca5b98d945f4bcdae26e5f567e', 'width': 32, 'height': 32}, {'url': 'https://preview.redd.it/award_images/t5_22cerq/niiatoknifn51_Hugz.png?width=48&amp;height=48&amp;auto=webp&amp;s=547d5fb33f5a4a5d6fc154cbd658638cc2b1c3a0', 'width': 48, 'height': 48}, {'url': 'https://preview.redd.it/award_images/t5_22cerq/niiatoknifn51_Hugz.png?width=64&amp;height=64&amp;auto=webp&amp;s=e17bc331183e7ba194314a34e43b35460a835fff', 'width': 64, 'height': 64}, {'url': 'https://preview.redd.it/award_images/t5_22cerq/niiatoknifn51_Hugz.png?width=128&amp;height=128&amp;auto=webp&amp;s=1b4e617f18af8d4e2c47c2f154d4422be43c809f', 'width': 128, 'height': 128}], 'icon_format': 'PNG', 'icon_height': 2048, 'penny_price': 0, 'award_type': 'global', 'static_icon_url': 'https://i.redd.it/award_images/t5_22cerq/niiatoknifn51_Hugz.png'}]",[],False,False,False,False,,[],False,,,,t5_2qhhq,,,,k08gnz,True,,Archerbro,,710,True,all_ads,False,[],False,,/r/investing/comments/k08gnz/dow_crosses_30000_markfirst_time_ever/,all_ads,False,https://www.reddit.com/r/investing/comments/k08gnz/dow_crosses_30000_markfirst_time_ever/,1209705,1606236054.0,1,,False
,investing,Can someone please explain what the SQQQ is? Someone told me that you can lose more than you invest with it because its a short is this true? I'm not looking to buy this stock I'm just trying to understand it. Why would someone buy it?  Thanks for the help.,t2_z7mly,False,,0,False,SQQQ?,[],r/investing,False,6,,0,,False,t3_k19k47,False,dark,1.0,,public,2,0,{},,False,[],,False,False,,{},,False,2,,False,,False,,[],{},,True,,1606398848.0,text,6,,,text,self.investing,False,"&lt;!-- SC_OFF --&gt;&lt;div class=""md""&gt;&lt;p&gt;Can someone please explain what the SQQQ is? Someone told me that you can lose more than you invest with it because its a short is this true? I&amp;#39;m not looking to buy this stock I&amp;#39;m just trying to understand it. Why would someone buy it?  Thanks for the help.&lt;/p&gt;
&lt;/div&gt;&lt;!-- SC_ON --&gt;",,,,,False,False,False,False,False,[],[],False,False,False,False,,[],False,,,,t5_2qhhq,,,,k19k47,True,,balls1016,,12,True,all_ads,False,[],False,,/r/investing/comments/k19k47/sqqq/,all_ads,False,https://www.reddit.com/r/investing/comments/k19k47/sqqq/,1209705,1606370048.0,0,,False
,investing,"What your view in buying Vertiv to get into cloud computing indirectly and benefit from being in a growth industry. 

It provides needed infrastructure to data centers. Also it started its dividend this year.

Seems it worth investing in for medium to long term growth. Won't blast off like tech stocks, but should provide decent growth.",t2_90l14b7n,False,,0,False,"VRT, is it a good way to invest in cloud computing growth?",[],r/investing,False,6,,0,,False,t3_k11jn1,False,dark,0.92,,public,10,0,{},,False,[],,False,False,,{},,False,10,,False,,False,,[],{},,True,,1606369188.0,text,6,,,text,self.investing,False,"&lt;!-- SC_OFF --&gt;&lt;div class=""md""&gt;&lt;p&gt;What your view in buying Vertiv to get into cloud computing indirectly and benefit from being in a growth industry. &lt;/p&gt;

&lt;p&gt;It provides needed infrastructure to data centers. Also it started its dividend this year.&lt;/p&gt;

&lt;p&gt;Seems it worth investing in for medium to long term growth. Won&amp;#39;t blast off like tech stocks, but should provide decent growth.&lt;/p&gt;
&lt;/div&gt;&lt;!-- SC_ON --&gt;",,,,,False,False,False,False,False,[],[],False,False,False,False,,[],False,,,,t5_2qhhq,,,,k11jn1,True,,one8e4,,12,True,all_ads,False,[],False,,/r/investing/comments/k11jn1/vrt_is_it_a_good_way_to_invest_in_cloud_computing/,all_ads,False,https://www.reddit.com/r/investing/comments/k11jn1/vrt_is_it_a_good_way_to_invest_in_cloud_computing/,1209705,1606340388.0,0,,False
